,file,sux_sentence,eng_tranlation_reference,eng_rule_based_translation,eng_nn_based_translation,rule_bleu,nn_bleu
130,P416415.conll,1(disz) udu niga bara2-an-na 2(disz) udu niga 3(disz)-kam us2 3(disz) udu niga 4(disz)-kam us2 {d}nanna 1(disz) masz2-gal niga 4(disz)-kam us2 dub-la2-mah uzu-a-bala 2(disz) udu niga 2(disz) masz2-gal niga gu4-e-us2-sa ezem-an-na 2(disz) udu niga 4(disz)-kam us2 du6-ur3 2(disz) udu niga 3(disz)-kam us2 2(disz) udu niga n-kam us2 {d}nun-gal 1(disz) udu niga dub-la2-mah 1(disz) udu niga gu4-e-us2-sa an-dur 1(disz) udu niga ... {d}szul-gi tur ... n ... da-an-da-an-da n ... {d}nin-gal ... n gu4-e-us2-sa {d}nin-uri5{ki} n ... {d}szu-{d}suen-ki-ag2-... n ... 1(disz) udu niga ...-kal-la 2(disz) udu niga ... {d}nin-ku3-nun-na 2(disz) udu niga 2(disz)-kam us2 {d}gu-la 1(disz) udu niga 1(disz) sila4 {d}nin-e2-gal giri3 {d}suen-a-bu-szu sagi u4 2(u) 8(disz)-kam ki a-ba-{d}en-lil2-gin7-ta ba-zi sza3 uri5{ki}-ma giri3 ur-{d}szul-gi-ra szar2-ra-ab-du iti u5-bi2-gu7 mu {d}szu-{d}suen lugal uri5{ki}-ma-ke4 na-ru2-a-mah {d}en-lil2 {d}nin-lil2-ra mu-ne-du3 4(u) , sheep barley fed for dais of an sheep barley fed of rd grade sheep barley fed of th grade for nanna buck barley fed of th grade for dublama sheep barley fed bucks barley fed following oxen festival of an sheep barley fed of th grade for mound of roof sheep barley fed of rd grade sheep barley fed of th grade for nungal sheep barley fed for dublama sheep barley fed following oxen for andur sheep barley fed for szulgi n for dandanda n for ningal n following oxen for ninuri n szu suen kiag n for sheep barley fed for  kalla sheep barley fed for ninkununa sheep barley fed of nd grade for gula sheep barley fed lamb for nin egal via suen abuu cup bearer the th day booked out from aba enlilgin in ur via ur szulgi arabdu month ubi feast year szu suen king of ur grand stele for enlil ninlil erected,one unit barley for dais An one unit followed his is of one barley one unit followed his is of one barley Nanna one billy_goat followed his is of one barley towards dublamah for Dublama one unit one barley billy_goat barley _ from Ezemanna one unit followed his is of one barley one of cultic_mound unit followed his is of one barley one unit followed his is of _ barley for Nungal one unit barley towards dublamah one unit barley _ An dur one unit barley <n> for Szulgir Tur <n> _ <n> for Dandanda _ <n> Ningal <n> _ _ for Ninuri _ <n> Szu Suen kiag _ <n> one unit barley <np> one unit barley <n> for Ninkununa one unit followed his is of one barley of Gula one unit one barley lamb for Ninegal foot Suenabuszu cup_bearer ten day semolina day from Abaenlilgin and Bazi heart of Urim foot Ur Szulgira was of administrator unit in Ubigu year Szusuen king of Urim magnificent_stele Enlil for Ninlil built it for them ten,1 sheep barleyfed for gula 2 sheep barleyfed of 3rd grade n sheep barleyfed of 2nd day,13.160313561138082,0.00890411009412945
131,P116240.conll,pisan-dub-ba a-sza3 du3-du3-a lu2 mar-sa sa12-du5 ka-guru7 szandana dub-sar gu4 udu giri3-se3-ga e2 {d}nin-gir2-su u3 {d}ba-ba6 aga3-us2 ensi2 i3-du8-me ma2-u4-zal-la i3-gal2 , basket of tablets xxx xxx xxx xxx xxx xxx xxx xxx xxx xxx xxx xxx,filing_basket field <np> person shipyard land_recorder supervisor gardenner scribe ox unit attendant house Ningirsu and For Baba soldier ruler xxx xxx life in,basket of tablets allocation of the field of the shipyard of you,7.393855342294482,17.980042487600972
132,P107220.conll,3(gesz2) 1(u) 9(disz) ninda gid2 1(disz) 1/2(disz) kusz3 dagal i3-hi 4(disz) kusz3 sukud 1(disz) ninda-na 1/2(disz) sar-ta kin-bi 1(gesz2) 3(u) 9(disz) 1/2(disz) sar gurusz 1(disz)-e 3(disz) 2/3(disz) gin2 1(disz) 5(disz) sze-ta a2-bi 2(gesz'u) 6(gesz2) 3(u) 2(disz) gurusz u4 1(disz)-sze3 gurusz 1(disz)-e a2-ni 6(disz) sila3-ta sze-bi 3(u) 1(asz) 4(barig) 1(ban2) 2(disz) sila3 gur lu2 hun-ga2-me 1(disz) 1/2(disz) ninda gid2 1(disz) 1/2(disz) kusz3 dagal 4(disz) kusz3 sukud kin-bi 2/3(disz) sar 5(disz) gin2 gan-tusz-me im du8-a gid2-da {gesz}kiri6 {d}ba-ba6-inim-si-sa2-a sza3 gar-szum{ki}-ka giri3 ur-{d}ba-ba6 dumu szabra-e2 lugal-mu-su-da u3 lugal-{d}ba-ba6 dumu ur-{d}lamma mu {d}i-bi2-{d}suen lugal , ninda length cubits average width cubits depth per ninda sar work involved sar per worker shekels the labor workdays disbursement per workerday sila the barley gur barig ban sila they are hired men ninda length cubits width cubits depth work involved sar shekels they are gantu pis wall construction drawn long in orchard of baba inim sisa of garum responsible ur baba son of household manager lugal musuda and lugal baba son of ur lamma the year ibbi suen is king,sixty one one pole one length one wide unit one average unit depth one one from per ninda from unit sixty work involved ten one one unit male <num> one one one unit day its labor from barley six_hundred sixty ten one male towards one day male <num> one shall from unit ten its barley one unit one unit sila unit they are hired men person one one pole one length one wide unit one unit depth one work involved unit day unit theirs are they are gantu spread clay longed orchard Baba inim sisa heart of Garum foot Urbaba child household manager Lugal musuda and Lugal baba child Urlamma year Ibbisuen king,wailing and lamentation uplum lice scabies nbum lice and parasites i dry outshrink from hunger and thirst,21.731880925051666,0.07782915631144664
133,P458027.conll,ur-{d}suen dub-sar dumu ur-{gesz}gigir , ur suen scribe son of ur gigir,for Ursuen scribe child of Urgigir,ursuen scribe son of urgigir,13.964781478313714,38.42714738729106
134,P458737.conll,{d}szu-{d}suen lugal kal-ga lugal uri5{ki}-ma lugal an ub-da limmu2-ba lu2-{d}szul-gi dub-sar dumu da-da arad2-zu , sz suen strong king king of ur king of four corners lu szulgi scribe son of dada is your servant,Szusuen king strong king of Urim king An of its four world of Luszulgir scribe child unknowns arad2 <vblex>,suen strong king king of ur menamnina,31.27508147088775,13.287635348602514
135,P107495.conll,pisan-dub-ba nig2-ka9-ak ab-ba-mu giri3 a-tu , basket of tablets accounts of abbamu via atu,filing_basket account of Abbamu foot Atu,basket of tablets accounts of abbamu via atu,7.028768406580073,100.0
136,P427603.conll,3(gesz2) 3(u) sig4 sza-at-i3-li2 ($ blank space $) 3(gesz2) 3(u) 2(gesz2) 2(u) la-hu-tum ($ blank space $) 2(gesz2) 2(u) nam-1(u) a-hu-ni szunigin 1/3(disz) sar 9(disz) gin2 igi-6(disz)-gal2 sig4 us2-bi 1(gesz2) 3(u) ninda a2 1(gesz2) 1(u) 2(disz)-ta geme2-bi 4(disz) 5(u) 1(disz) 2/3(disz) gin2 u4 1(disz)-sze3 sze 3(disz) sila3-ta ba-hun sze-bi 1(u) 4(disz) 1/2(disz) sila3 5(disz) gin2 a2 sig4 ga6-ga2 e2-ki-ba-gar-ra pi5-sza-ah-dingir mu-kux(du) me-e2-a giri3 {d}iszkur-tillat iti ezem-me-ki-gal2 mu {d}szu-{d}suen lugal-e na-ru2-a-mah {d}en-lil2 {d}nin-lil2-ra mu-ne-du3 , bricks by szat il of lalkuda bricks by lahutum bricks of ahuni total  sar shekels bricks the length involved ninda at labor of the female laborers involved and shekels workdays at sila per hired the barley involved sila shekels labor of carrying bricks replacement house of piah ilim delivery of simat ea via adad tillat month festival of mekigal year su suen king great stele for enlil and ninlil erected,sixty ten brick by Szat il <n> <n> space <n> sixty ten sixty ten bricks by Lahutum <n> <n> space <n> sixty ten <num> Ahuni one total one unit one unit the length involved brick sixty ten pole sixty arm one from one its female_worker one ten one one unit towards one day one unit from unit was hired one its barley one one sila day unit arm carried brick replacement house Piah ilim year kux(went ) Simat Ea foot Adad tillat unit Ezemmekigal year Szusuen king magnificent_stele Enlil for Ninlil built it for them,215 workdays,13.043517022169285,5.730798236055335e-14
137,P470064.conll,9(asz) sze gur sa2-du11 {d}szara2 szu-palil2 gu2-edin-na-ta ki e2-gal-e-si-ta ha-la szu ba-ti iti sze-sag11-ku5-ta iti nesag-sze3 mu us2-sa sza-asz-ru{ki} ba-hul ha-la dumu lugal-e2-mah lu2 lunga {d}szara2 , gur barley regular offering for szara from gu edina from egalesi did ala receive from month harvest to month first fruit offering year after szaru was destroyed ala son of lugal ema brewer of szara,one unit unit offerings Szara offering for and from Guednina day of Egalesi unknown for Hala hand was n him unit from Szesagku unit towards first_fruit_offering followed year Szaszru place for Hala child Lugal ema person of brewer Szara,9 gur barley regular offering of ara from guedina,14.512948213594951,3.2122613282884482
138,P432162.conll,x x '. nin-a-ni-ir '. da-ra-am-uri5{ki}-am '. dumu-munus a-pil-ki-in '. lugal ma-ri2{ki}-ka '. e2-gi4-a '. ur-{d}namma '. lugal uri5{ki}-ma , for goddess dn her mistress tarm uram daughter of apil kn the king of mari bride of ur namma king of ur,_ _ <n> for his his lady <n> Tarm Uram <n> daughter Apil kn <n> king of Mari <n> bride <n> of Urnamma <n> king of Urim,spending time eating way too much having horrible diarrhea you may be able to croakchew when you stand in the plain towards him the king of ur the watery deep belowfrom the earth,23.10325762059593,11.367170068536701
139,P432127.conll,{d}nanna dumu-sag {d}en-lil2-la2 lugal-a-ni ur-{d}namma nita kal-ga lugal uri5{ki}-ma lugal ki-en-gi ki-uri-ke4 lu2 e2 {d}nanna in-du3-a nig2-ul-li2-a-ke4 pa mu-na-e3 mu-na-e3 gaba a-ab-ka-ka ki-sar-a nam-ga-esz8 bi2-silim ma2 ma2-gan szu-na mu-ni-gi4 , for nanna the first born son of enlil his master ur namma the mighty man the king of ur and king of sumer and akkad the man who temple of nanna built he made an everlasting thing appear resplendently on sea coast in he restored long distance trade to health and returned boats of magan to his control,Nanna the first born son Enlila for his his master of Urnamma male strong king of Urim king kiengi of and Akkad person house that Nanna built him that he branch an everlasting thing appear resplendently an everlasting thing appear resplendently frontier of on sea coast on in he restored he trade to health long distance ship and returned Szuna boats Magan to it on him,for nanna the firstborn son of enlil his master urnamma king of ur and king of sumer and akkad he returned to him,46.33159299469596,17.55981965321495
140,P209263.conll,1(disz) 1/2(disz) ninda gid2 3(disz) kusz3 dagal 2(disz) kusz3 bur3 a-sza3-bi 2/3(disz) sar 5(disz) gin2 1/2(disz) ninda 4(disz) kusz3 gid2 4(disz) kusz3 dagal 2(disz) 1/3(disz) kusz3 bur3 a-sza3-bi 2/3(disz) sar la2 1(disz) gin2 2(disz) ninda gid2 4(disz) kusz3 dagal 1(disz) 2/3(disz) kusz3 bur3 a-sza3-bi 1(disz) sar 6(disz) 2/3(disz) gin2 2(disz) ninda gid2 4(disz) kusz3 dagal 1(disz) kusz3 bur3 a-sza3-bi 2/3(disz) sar 3(disz) 1/2(disz) ninda 3(disz) kusz3 gid2 4(disz) kusz3 dagal 2(disz) kusz3 bur3 a-sza3-bi 2(disz) 1/2(disz) sar 1/2(disz) ninda 1(disz) kusz3 gid2 2(disz) 2/3(disz) kusz3 dagal 1(disz) 1/3(disz) kusz3 bur3 a-sza3-bi 1(u) 1/3(disz) gin2 1/2(disz) ninda gid2 3(disz) kusz3 dagal 2(disz) kusz3 bur3 a-sza3-bi 1(u) 5(disz) gin2 1/2(disz) ninda gid2 3(disz) kusz3 dagal 1(disz) 1/3(disz) kusz3 bur3 a-sza3-bi 1(u) gin2 1(disz) 1/2(disz) ninda 2(disz) kusz3 gid2 nu-ak 1(disz) ninda 1(disz) kusz3 gid2 3(disz) kusz3 dagal 1(disz) 2/3(disz) kusz3 bur3 a-sza3-bi 1/3(disz) sar 7(disz) gin2 8(disz) gin2 dub-la2 szunigin 6(disz) 2/3(disz) sar 1(disz) gin2 kin sahar im-du8-a e2 nig2-lagar-ka , ninda length cubits width cubits depth its volume sar shekels ninda cubits length cubits width cubits depth its volume sar less shekel ninda length cubits width cubits depth its volume sar shekels ninda length cubits width cubit depth its volume sar ninda cubits length cubits width cubits depth its volume sar ninda cubit length cubits width cubits depth its volume shekels ninda length cubits width cubits depth its volume shekels ninda length cubits width cubits depth its volume shekels ninda cubits length unfinished ninda cubit length cubits width cubits depth its volume sar shekels shekels dubla total sar shekel earthwork pis walls for household of nig lagar,one one pole one length wide unit one unit depth one its a field it unit day one unit one pole unit one length wide unit one one unit depth one its a field it unit one unit one unit pole one length wide unit one one unit depth one its a field it one unit one one unit pole one length wide unit one unit depth one its a field it one unit one one pole unit one length wide unit one unit depth one its a field it one one unit one pole unit one length one wide unit one one unit depth one its a field it one one unit pole one length wide unit one unit depth one its a field it day one unit pole one length wide unit one one unit depth one its a field it one unit one one pole unit length unfinished one one pole unit one length wide unit one one unit depth one its a field it one unit unit king unit the Dublamah one total one one unit unit work earth wall house walls for household Nig lagar,1 12 ninda the length 3 cubits the width 2 23 cubits the depth,9.765823023054901,0.02044444718269216
141,P429958.conll,pisan-dub-ba nig2-ka9-ak e2 egir ...-x{ki}-x ... ... ... x szu x x ur-nigar{gar} x i3-gal2 mu {d}amar-{d}suen lugal ur-bi2-lum{ki} mu-hul , basket of tablets xxx xxx xxx xxx xxx xxx xxx xxx xxx xxx,filing_basket account house <n> xxx <n> <n> <n> _ hand _ _ for Urnigar _ life in year Amarsuen king he n Urbilum,basket of tablets accounts of the house of cantorship have been propped against the wall urnigar received year amarsuen is king urbilum destroyed,2.47228453827878,11.91782194662377
142,P204751.conll,pisan-dub-ba x-da i3-gal2 mu , basket of tablets long tablets and debits are here year,filing_basket _ life in year,basket of tablets are here year,4.374848489043043,48.555993224365864
143,P424381.conll,1(u) 6(disz) gurusz u4 2(disz)-sze3 umma{ki}-ta du6-gesz-i3-ka-sze3 ma2 su3 gid2-da u4 2(disz)-sze3 sze gesz e3-a u3 ma2-a si-ga u4 1(disz)-sze3 i7 sal4-la{ki}-asz ma2 gid2-da u4 3(disz)-sze3 sze ba-al-la sze bala-a u3 guru7-a im-ur3-ra ugula ur-{d}szakkan kiszib3 ur-{d}szara2 mu en ga-esz{ki} ba-hun ur-{d}szara2 dub-sar dumu szesz-kal-la , laborers for days from umma to dugei an empty boat towed for days barley threshing and in boat loaded for day to salla canal boat towed for days grain unloaded grain transferred and silo plastering foreman ur szakkan sealed document of ur szara year lord of gae was installed ur szara scribe son of szekalla,one one male towards one day of Umma to Dugei an empty emptied ship longed towards one day unit left tree and loaded in ship towards one day river to Salla canal towed longed ship towards one day transferred unit unit of tax and plastering in store overseer for Urszakkan unit Urszara year he was hired priest of Gaesz Urszara scribe child of Szeszkala,16 laborers for 2 days from umma to dugei an empty boat towed,14.835506524401222,3.2452418376144965
144,P432267.conll,{d}amar-{d}suen lugal kal-ga lugal uri5{ki}-ma lugal an ub-da limmu2-ba-ke4 ki en-nu-ga2 uri5{ki}-ma mu-na-du3 ki en-nu-ga2-ba {d}amar-{d}suen ki-ag2 {d}nanna mu-bi-im , amar suena the mighty king king of ur and king of four world quarters the place of watch in ur he built for him this place of watch amar suena is beloved of nanna is its name,Amarsuen king strong king of Urim king An and quarters world day of prison of Urim n it for him day this of This place watch loved Amarsuen Nanna his is its is its name,amarsuen strong king king of ur and,34.9818367304339,0.966315827889522
145,P382205.conll,1(gesz2) 1(u) 4(disz) 1/2(disz) gurusz u4 1(disz)-sze3 gan2 ur-{gesz}gigir szabra 1(gesz2) 3(u) 4(disz) gurusz u4 1(disz)-sze3 gan2 ur-{gesz}gigir nu-banda3-gu4 2(gesz2) 2(u) 7(disz) gurusz u4 1(disz)-sze3 gan2 lugal-gu4-e gi zex(sig7)-a gi ku5-a u3 {u2}hirinx(kwu318)-na zex(sig7)-a a-sza3 a-gesztin-na ugula lu2-giri17-zal kiszib3 szesz-kal-la dumu da-da iti dal iti szu-numun mu en-mah-gal-an-na {d}nanna ba-hun lugal-nig2-lagar-e dub-sar dumu da-da , workdays land parcel of ur gigir chief administrator workdays land parcel of ur gigir oxen manager workdays land parcel of lugal gue reed uprooted reed cut and hirin weed uprooted field a getina foreman lu giri zal under seal of szekalla son of dada month flight month month sowing year enmagalana of nanna was installed lugal nig lagare scribe son of dada,sixty one one one male towards one day gan2 of Urgigir sixty chief_administrator ten one male towards one day gan2 of Urgigir sixty ox_overseer ten one male towards one day gan2 xxx reed zex( sig7) water reed cut and { grass} hirinx( kwu318) stone_weight zex( sig7) water field A getina overseer for Lugirizal unit of Szeszkala child unknowns unit in Dal unit in Szunumun year Enmahgalana Nanna was hired of Lugalniglagare scribe child unknowns,74 12 workdays under seal of urgigir the chief household administrator 94 workdays,11.039782273310008,0.9265568669819172
146,P319075.conll,a2-pa5 na-ba-sa2-ta 1(gesz2) 3(u) ninda gid2 1(disz) kusz3 dagal 1(disz) kusz3 sukud a-sza3 7(disz) 1/2(disz) sar 1(gesz2) ninda gid2 1(disz) kusz3 dagal 2(disz) kusz3 sukud a-sza3 2(u) sar a-pi4-sal4 x ... 2(u) ... a-sza3 ... 1(u) 2(disz) x ... a ... a ... '. ... '. 5(disz) '. a-sza3 4(disz) 1/2(disz) sar 5(disz) gin2 '. e a-sza3 pirig-tur-gin7-du-sze3 '. szunigin 8(gesz2) 5(u) ninda gid2 '. szunigin 1(gesz2) 5(u) 8(disz) 1/2(disz) sar kin sahar u3 u2-sag11 '. e a-sza3 lugal-mu10-us2-sa2 gaba a-gesztin-na-ka '. e ki-sumun-na gid2-da '. ugula sanga {d}dumu-zi u3 sanga {d}nin-dar-a mu gu-za {d}en-lil2-la2 ba-dim2 , from side of nabasa canal ninda length cubit width cubit height the volume sar ninda length cubit width cubits height the volume sar apisal the volume n n from side of ninda length cubit width cubit height the volume sar shekels for a levee in field pirigtur gin du total ninda length total sar activity for earthwork and reed bundle for barges the levee of lugal mussa field that is in front of a getin field has been measured up to levee of a plot with poor soil the foremen chief adminstrator of dumuzi and chief administrator of nin dara year throne of enlil was fashioned,From side from Nabasa canal sixty ten pole one length wide unit one unit depth one field one sixty unit pole one length wide unit one unit depth ten field unit Apisal _ <n> ten <n> field <n> one one _ <n> water <n> water <n> <n> <n> <n> day <n> one field one unit day unit <n> levee field After Tur gin7 went sze3 <n> sixty total ten pole length <n> sixty total ten one king unit work earth and barges activity for reed bundle for <n> levee field The Lugal mussa that frontier A getin field is in front <n> levee longed with poor soil been measured up to plot <n> overseer temple_administrator in Dumuzi and temple_administrator by Nindara year chair Enlila was created,from the side of the nabasa canal 9 ninda the length 1 cubit the width 1 cubit the height the volume 2 12 sar,22.601705640425184,1.778895057304565
147,P480699.conll,iti sze-sag11-ku5 mu {d}szu-{d}suen lugal uri5{ki}-ma-ke4 ma2 dara4-abzu {d}en-ki-ka bi2-in-du8 , month harvest year shu suen king of ur boat ibex of abzu caulked,unit Szesagku year Szusuen king of Urim ship he caulked Dara abzu of Enkik,month harvest year the shusuen king of ur the boat named ibexofabzu caulked,27.895334464026217,52.79340364727037
148,P458818.conll,{d}szu-{d}suen nita kal-ga lugal uri5{ki}-ma lugal an ub-da limmu2-ba ur-dub-la2-mah aga3-us2 lugal dumu arad2-x arad2-zu , sz suen strong man king of ur king of heaven with its four corners ur dublama great soldier son of arad  is your servant,Szusuen male strong king of Urim king An of its four world Ur dublama soldier king child arad2 _ arad2 <vblex>,suen strong man king of ur urdublama greatsoldier,25.821135825442582,10.02709142612316
149,P205489.conll,pisan-dub-ba e2-szu-szum2-ma usz-bar lu2-x e2 usz-bar e2-gal u3 e2 usz-bar nin-dingir {d}ba-ba6 lu2-inim-nig2-sa6-ga sza3 gir2-su{ki} i3-gal2 mu , basket of tablets house of consignments weavers lu  house of weavers of palace and house of weavers of priestess of baba lu inimnigsaga in girsu are here year,filing_basket house of receipt weaver for <np> house weaver palace and house weaver xxx For Baba xxx heart of Girsu life in year,basket of tablets reports of doctors and female weavers,24.190720555868637,6.3178986040908365
150,P432239.conll,{d}nin-dar-a lugal uru16 x ... lugal-a-ni nam-ti {d}szul-gi nita kal-ga lugal uri5{ki}-ma lugal ki-en-gi ki-uri-ka-sze3 {d}szul-gi-ki-ur5-sa6-kalam-ma-ka lu2 {gesz}tag-ga-ni alan-a-ni mu-du2 alan-na {d}szul-gi a2 szum2-ma {d}nin-dar-a zi-sza3-gal2 iri-na mu-bi x x x x za x x x ka bur-ra ki an-na-ka ab2-ba szu tum3 u4 ezem-ma-ka e2 {d}nin-mar{ki}-ka sag kisal-la dab5-ba 5(asz) dug dida 7(asz) dug kasz 1(barig) 1(ban2) zi3 lugal 1(disz) gada ga-dul9 1(disz) gada gu-za {gesz}dar-du3 {gesz}erin u3 gab2-ra {gesz}erin 7(disz) ma-na a-ra2 2(disz)-am3 1(gesz'u) la2 1(u) ku6 al-dar-ra 1(asz) mun gur lugal 1(asz) naga gur dug sila3 |igixx| 1(asz) ku3 ... ku6 ab-ba har ku3-x 1(asz) dug i3-x x nig2-ba gaszam-kam gir2-su{ki} sze il2-la-ka ma2 szu du7-a gu2-ab-ba{ki}-ta du8-dam nam-lu2-be6-lu5-da e2-ta izi la2-a gaszam-kam bala u4 1(u) u3 igi-3(disz)-gal2 e2 ki-es3-sa{ki}-ga e2 gir2-su{ki}-ka igi-3(disz)-gal2 ma2 esz3 ge6 zal u3 ma2 kar-e!(bur) tag-da-bi nig2-ba 5/6(disz){sza}-bi ma2 nigin9-bar-sze3 de6-a-bi nig2-dab5-bi lu2 nu-da-tuku ur2 gu4 udu e2-gal e2-sag u3 bara2 {d}nin-gir2-su-ka nam-szita4 kislah szuku a-gub2-bi e2-sag udu e2-gal ur2 udu ama siki 5(disz) sila3 i3-nun 1(barig) zu2-lum lugal n(disz) 1(ban2) ga-ar3 1(ban2) ga 1(u) sila3 gesztin n(disz) {gesz}pesz3 sze-er-gu 4(disz) {gesz}haszhur sze-er-gu ninda kaskal gu2-ab-ba{ki}-sze3 nig2-dab5 gaszam-kam a-sza3 ambar tur a-sza3 ki-mu-ra a-sza3 gesz-gi tur a-sza3 a-gesztin-na a-sza3 x-gi4-a giri3-gen-na gaszam-kam udu e2 lah5 masz2 inim-ma nig2-dab5 gaszam-kam u4 ul-li2-a-sze3 lu2 gesz udun i3-na-szum2-da lu2-ba {d}lamma-a-ni he2-me mu-mu he2-pa3-de3 en3-mu he2-tar-re , for nindara the powerful king his master for life of szulgi the mighty man king of ur and king of sumer and akkad szulgi kiursa kalama his person in charge of sacrifices a statue of him he created the statue szulgi given strength by nindara the inspiration of his city is its name the opening of bowl dealing with cows in place of an on day of festival in temple of ninmar when first are taken into courtyard jugs of sweet wort jugs of beer barig and ban of royal flour linen cover and linen for throne cedar sprouts and cedar herders times minas of them split fish royal gur of salt gur of soda quart jugs of silver fish of sea silver rings jug of oil were gifts of artisans in girsu in month of barley transporting a properly equipped boat which is to be caulked from guabba the office of master of ceremonies one who bears fire from temple belong to artians a term of ten days and a one third in temple of ki es one third in temple of girsu that when boat spends night at shrine and when boat lands at quay an allotment of of that for when boat is taken to outer district these requisitions were owed to no person legs of beef and mutton of palace and grain stores and dais of ningirsu the office of ita priest with its uncultivated land subsistance plots holy water the grain store of palace sheep legs of wool bearing mother sheep quarts of ghee barig of royal dates n plus ban of cheese ban of milk quarts of wine n strings of figs strings of apples food for jourey to guabba are requisitions of artisans the field little marsh the field kimura the field little canebrake vinegar field the field is list of artisans the sheep come from temple and goats of word are requisitions of artisans forever for one who will put wood into oven for him may i be that mans guardian angel may he invoke my name and tend to me,by Nindara the powerful king _ <n> for his his master life for Szulgir male strong king of Urim king kiengi of and and Akkad Szulgi kiursa kalama person his his person in charge sacrifices for his a statue him he created towards him his The statue for Szulgir arm of garlic <vblex> by Nindara life heart His City its name _ _ _ _ unknown _ _ _ mouth opening bowl day of dealing with cows in Place An hand <vblex> day On day festival house of temple Ninmar head when first are taken into courtyard one seize pot one sweet_wort pot beer unit unit unit one king flax linen cover one flax chair cedar cedar and of rider one cedar unit his is one times six_hundred one unit fish split one salt unit one king potash unit pot sila |igixx| one silver <n> fish father nose for silver one pot for oil _ gift artisans of Girsu unit In in month transporting ship in_working_order hand is to be caulked from Guabba from which the office master ceremonies from house weighed its xxx artisans tax one day and a one third house in temple Ki es house of Girsu a one third ship black shrine that when spends night and ship <n> !(levee <n>) lands at quay gift <num> ship boat is taken to outer district for when of these person requisitions were owed to no person on ox unit palace the grain store and and of of Ningirsu the office ita priest lot ration of its uncultivated land subsistance plots holy water the grain store unit palace on unit <n> wool day sila ghee unit date king <n> unit cheese unit one milk sila vine <n> fig one string apple trees string pole towards journey of to Guabba requisitions artisans field <np> Tur field the Kimura field xxx Tur field A getina field the is list artisans unit house The come from temple goat word requisitions artisans day Forever person tree one who will put him wood into oven for may I be that mans guardian angel years he invoke my name his and tend he2 asked,suen strong man the king of isin his master for the life of ulgi,42.39330330374301,2.3463165379965745e-09
